{
  "format": "eac-feature-pack-v1",
  "id": "dev.dsh-eac.agent-team-base",
  "version": "0.2.0",
  "category": "function",
  "source": "https://github.com/DSH-EAC/dsh-mojobox",
  "author": "DSH-EAC",
  "license": "MIT",
  "sha256": "6725ac57233775f23357a8b8c9540902c163283dae9d906ee5a0f0e0574218ee"
}
