{
  "format": "eac-feature-pack-v1",
  "id": "dev.dsh-eac.conversation-migration",
  "version": "0.1.0",
  "category": "function",
  "source": "https://github.com/DSH-EAC/dsh-mojobox",
  "author": "DSH-EAC",
  "license": "MIT",
  "sha256": "fdb5da4e866ff78a9d4d6777390e6761229e6b5bec6ceb411ec674f63c0f3bca"
}
