{
  "format": "eac-feature-pack-v1",
  "id": "dev.dsh-eac.skin-wallpaper-engine",
  "version": "0.1.0",
  "category": "appearance",
  "source": "https://github.com/DSH-EAC/dsh-mojobox",
  "author": "DSH-EAC",
  "license": "MIT",
  "sha256": "aff9f6ef1cdc1231db3bd29d81a4cf686b843e8027ac38136080e9c983941c8f",
  "appearance": {
    "kind": "appearance",
    "previews": [
      "https://raw.githubusercontent.com/elysia395/dsh-wallpaper-engine/5ba2acff8bbc5ab3b9fb64ca7f37d0052c5a7ce7/docs/images/main-interface.gif"
    ],
    "notes": "上游要求先更新 DSH 内核与 Better Sidebar，声明 DSH >=0.1.5-rc.1、桌面 >=2.0.7、侧栏 >=0.19.0。本包含侧栏引用；壁纸与可选媒体工具由用户提供。自带插件入口，不声明 EAC loader 依赖；全局玻璃/背景样式与其他外观插件的组合未验证。"
  }
}
